{
  "registryType": "masa-term-registry",
  "registryVersion": "0.1.0",
  "masaVersion": "0.1.0",
  "namespace": "https://masa.sonicfield.org/vocab/0.1.0#",
  "terms": [
    {
      "id": "masa:MatterRecord",
      "label": "MatterRecord",
      "termStatus": "working-term",
      "provenanceClass": "curator-directive",
      "definition": "A versioned envelope relating sources, representations, encounters, listening passes, claims, operations, actors, policies, contexts, and lineage without claiming to be the sonic event itself.",
      "introduced": "0.1.0",
      "references": ["MASA Core 0.1.0, section 5.1"],
      "nonEquivalentTo": ["physical event", "signal", "audio asset", "sound object", "auditum"]
    },
    {
      "id": "masa:Actor",
      "label": "Actor",
      "termStatus": "working-term",
      "provenanceClass": "curator-directive",
      "definition": "A human, community, organization, software system, agent, model, or instrument participating in a claim or operation, whose identity may be pseudonymous, opaque, or withheld.",
      "introduced": "0.1.0",
      "references": ["MASA Core 0.1.0, section 5.2"],
      "nonEquivalentTo": ["runtime authority", "confidence", "author of record"]
    },
    {
      "id": "masa:Source",
      "label": "Source",
      "termStatus": "working-term",
      "provenanceClass": "mixed",
      "definition": "A typed origin or causal reference whose identification, authority, coverage, rights, health, freshness, and uncertainty remain explicit.",
      "introduced": "0.1.0",
      "references": ["MASA Core 0.1.0, section 5.3"],
      "nonEquivalentTo": ["causal certainty", "representation"]
    },
    {
      "id": "masa:Representation",
      "label": "Representation",
      "termStatus": "working-term",
      "provenanceClass": "mixed",
      "definition": "A material or digital carrier available to a system, such as a file, stream, signal, buffer, dataset, prompt, image, mesh, or performance capture.",
      "introduced": "0.1.0",
      "references": ["MASA Core 0.1.0, section 5.4"],
      "nonEquivalentTo": ["original event", "MatterRecord"]
    },
    {
      "id": "masa:Encounter",
      "label": "Encounter",
      "termStatus": "working-term",
      "provenanceClass": "mixed",
      "definition": "The situated moment and access conditions through which matter enters a research or operational process.",
      "introduced": "0.1.0",
      "references": ["MASA Core 0.1.0, section 5.5"],
      "nonEquivalentTo": ["capture", "complete event"]
    },
    {
      "id": "masa:Aperture",
      "label": "Aperture",
      "termStatus": "adapted-term",
      "provenanceClass": "project-corpus",
      "definition": "The channels, ranges, windows, thresholds, preprocessing, exclusions, and blind spots through which observation or listening becomes possible.",
      "introduced": "0.1.0",
      "references": ["The Agentic Auditum", "MASA Core 0.1.0, section 5.5"],
      "nonEquivalentTo": ["neutral access", "complete sensorium"]
    },
    {
      "id": "masa:ListeningPass",
      "label": "ListeningPass",
      "termStatus": "working-term",
      "provenanceClass": "mixed",
      "definition": "An attributable, situated human or machine-assisted listening account under declared modes and an aperture.",
      "introduced": "0.1.0",
      "references": ["MASA Core 0.1.0, section 5.5"],
      "nonEquivalentTo": ["final truth", "audio classification"]
    },
    {
      "id": "masa:Claim",
      "label": "Claim",
      "termStatus": "working-term",
      "provenanceClass": "project-corpus",
      "definition": "A typed statement whose evidential basis is heard, measured, inferred, interpreted, speculative, or undetermined.",
      "introduced": "0.1.0",
      "references": ["MASA Core 0.1.0, section 5.6"],
      "nonEquivalentTo": ["confidence", "actor", "source health", "freshness", "disclosure"]
    },
    {
      "id": "masa:OperationReceipt",
      "label": "OperationReceipt",
      "termStatus": "working-term",
      "provenanceClass": "mixed",
      "definition": "An immutable account of an attempted operation, its inputs, outputs, actors, method, parameters, policy evaluation, status, and reversibility.",
      "introduced": "0.1.0",
      "references": ["MASA Core 0.1.0, section 5.8"],
      "nonEquivalentTo": ["successful output", "permission"]
    },
    {
      "id": "masa:Relation",
      "label": "Relation",
      "termStatus": "working-term",
      "provenanceClass": "mixed",
      "definition": "An attributable typed assertion connecting two identified objects without implying equivalence.",
      "introduced": "0.1.0",
      "references": ["MASA Core 0.1.0, section 5.9"],
      "nonEquivalentTo": ["identity", "ownership"]
    },
    {
      "id": "masa:Mapping",
      "label": "Mapping",
      "termStatus": "working-term",
      "provenanceClass": "mixed",
      "definition": "An authored relation from a source observation or derived field to a target parameter, including normalization, ranges, curve, smoothing, missing-data behavior, and epistemic note.",
      "introduced": "0.1.0",
      "references": ["MASA Mapping profile 0.1.0"],
      "nonEquivalentTo": ["source voice", "source observation", "synthesis"]
    },
    {
      "id": "masa:Policy",
      "label": "Policy",
      "termStatus": "working-term",
      "provenanceClass": "mixed",
      "definition": "A machine-readable account of permissions, prohibitions, duties, unknowns, validity, authority basis, and review routes.",
      "introduced": "0.1.0",
      "references": ["MASA Core 0.1.0, section 5.10", "MASA policy and disclosure 0.1.0"],
      "nonEquivalentTo": ["consent", "jurisdiction", "ethical legitimacy", "runtime authority"]
    },
    {
      "id": "masa:Context",
      "label": "Context",
      "termStatus": "working-term",
      "provenanceClass": "mixed",
      "definition": "A historical, territorial, ecological, institutional, compositional, cosmological, technical, or namespaced frame with declared provenance and claim status.",
      "introduced": "0.1.0",
      "references": ["MASA Core 0.1.0, section 5.11"],
      "nonEquivalentTo": ["universal background", "neutral metadata"]
    },
    {
      "id": "masa:material-transduction",
      "label": "material transduction",
      "termStatus": "working-term",
      "provenanceClass": "curator-directive",
      "definition": "An inspectable passage among material events, observations, data relations, sonic controls, renders, and renewed listening.",
      "introduced": "0.1.0",
      "references": ["MASA relation registry 0.1.0, masa:transduced-from"],
      "nonEquivalentTo": ["literal source sound", "unmediated conversion"]
    },
    {
      "id": "research:acoulogy",
      "label": "acoulogy",
      "termStatus": "source-term",
      "provenanceClass": "external-source",
      "definition": "A discipline concerned with what is heard and the processes through which listening forms its objects; retained with Schaeffer and Chion lineage visible.",
      "introduced": "0.1.0",
      "attributedTo": ["Pierre Schaeffer", "Michel Chion"],
      "sourceIds": ["src-20260718-treatise-on-musical-objects--an-essay-ac-4e795a70", "src-20260718-sound-an-acoulogical-treatise-d5cede55"],
      "references": ["Pierre Schaeffer, Treatise on Musical Objects", "Michel Chion, Sound: An Acoulogical Treatise"],
      "nonEquivalentTo": ["acoustics", "automatic classification"]
    },
    {
      "id": "research:auditum",
      "label": "auditum",
      "termStatus": "adapted-term",
      "provenanceClass": "mixed",
      "definition": "Something heard in Chion's acoulogical account; the Algoacoulogy program extends it as a wider mode-open relational field.",
      "introduced": "0.1.0",
      "attributedTo": ["Michel Chion", "Algoacoulogy adaptation"],
      "sourceIds": ["src-20260718-sound-an-acoulogical-treatise-d5cede55", "src-20260718-the-agentic-auditum-listening-as-a-progr-423ebe1d"],
      "references": ["Michel Chion, Sound: An Acoulogical Treatise", "The Agentic Auditum"],
      "nonEquivalentTo": ["sound object", "physical wave", "MatterRecord"]
    },
    {
      "id": "research:sound-object",
      "label": "sound object",
      "termStatus": "source-term",
      "provenanceClass": "external-source",
      "definition": "A perceptual object constituted through a disciplined listening cut in the Schaefferian lineage.",
      "introduced": "0.1.0",
      "attributedTo": ["Pierre Schaeffer"],
      "sourceIds": ["src-20260718-treatise-on-musical-objects--an-essay-ac-4e795a70"],
      "references": ["Pierre Schaeffer, Treatise on Musical Objects"],
      "nonEquivalentTo": ["sounding body", "auditum", "MatterRecord"]
    },
    {
      "id": "research:microsound",
      "label": "microsound",
      "termStatus": "source-term",
      "provenanceClass": "external-source",
      "definition": "Sonic events below the conventional note and their organization across nested temporal scales; one scale within sonic matter.",
      "introduced": "0.1.0",
      "attributedTo": ["Curtis Roads"],
      "sourceIds": ["src-20260718-75003-pdf-0a7c9e6f"],
      "references": ["Curtis Roads, Microsound"],
      "nonEquivalentTo": ["sonic matter as a whole", "universal sonic atom"]
    },
    {
      "id": "research:grain",
      "label": "grain",
      "termStatus": "source-term",
      "provenanceClass": "external-source",
      "definition": "An elementary enveloped signal on the micro time scale, shorter than a note, whose combination by the hundreds or thousands per second generates textures, streams, and clouds.",
      "introduced": "0.1.0",
      "attributedTo": ["Curtis Roads"],
      "sourceIds": ["src-20260718-composing-electronic-music-a-new-aesthet-924507c9", "src-20260718-75003-pdf-0a7c9e6f"],
      "references": ["Curtis Roads, Composing Electronic Music: A New Aesthetic, chapter 2", "Curtis Roads, Microsound"],